Question Number,Multiplier,en,de,ar,cs,zh
0,-1,Someone suffered emotionally.,Die Gefühle von jemandem werden verletzt., هناك شخص ما قد عانى وجدانياً ,Někdo emocionálně trpěl.,某人感情上受到伤害
1,-1,Some people were treated differently from others.,Einige Menschen werden anders behandelt als andere., هناك أفراد يعامَلون بطريقة مختلفة عن الآخرين ,S některými lidmi se zacházelo jinak než s ostatními.,某人被区别对待 
2,1,Someone’s action showed love for his or her country.,Handlungen geschehen aus Vaterlandsliebe., تصرفات شخص ما تظهر حباً لبلده ,Někdo svými činy projevoval lásku ke své zemi.,某人的行为体现了对国家的热爱
3,1,Someone showed respect for authority.,Jemand hat Respekt vor Authoritäten gezeigt.,أظهر شخص ما احتراماً للسلطة,Někdo projevil respekt k autoritám.,某人表现出对权威的尊重
4,-1,Someone violated standards of purity and decency.,Jemand hat gegen Anstand und Reinheit verstossen., انتهك شخص ما معايير اللياقة والحشمة,Někdo nechoval cudnodně a počestně.,某人不守名节
5,0,Someone was good at math.,Jemand zeigt in Mathematik gute Leistungen.,كان شخص ما جيدًا في الرياضيات.,Někdo byl dobrý v matematice.,某人擅长数学
6,1,Someone cared for someone weak or vulnerable.,Jemand setzt sich für eine andere verletzbare und schwache Person ein., هناك شخص ما قد اعتنى بشخص ضعيف أو مستضعف ,Někdo se staral o někoho slabého nebo zranitelného,某人关心处于弱势的人（弱势群体）
7,-1,Someone acted unfairly.,Jemand handelt ungerecht., هناك شخص ما قد تصرف بشكل غير عادلة ,Někdo jednal neférově.,某人有不公正的行为
8,-1,Someone did something to betray his or her group.,"Jemand hat etwas getan, um seine oder ihre Gruppe zu hintergehen und sie zu betrügen.",فعل شخص ما شيئاً ما لخيانة جماعته,"Někdo udělal něco, čím zradil svou skupinu.",某人背叛了自己的组织／团体
9,1,Someone conformed to the traditions of society.,Jemand hat sich an die Traditionen der Gesellschaft gehalten.,التزم شخص ما بتقاليد مجتمعه,Někdo jednal v souladu se společenskými tradicemi.,某人遵循社会传统
10,-1,Someone did something disgusting.,Jemand hat etwas ekelhaftes getan.,فعل شخص ما شيئاً شائناً ومثيراً للاشمئزاز,Někdo udělal něco nechutného.,某人做了恶心的事
11,-1,Someone was cruel.,Jemand war grausam.,هناك شخص ما قاسياً,Někdo byl krutý.,某人很残忍
12,-1,Someone was denied his or her rights.,Jemandem wurden seine oder ihre Rechte verweigert.,هناك شخص ما قد حُرِم من حقوقه,Někomu byla upřena práva,某人的权利被忽视
13,1,Someone showed loyalty.,Jemand zeigt Loyalität.,أظهر شخص ما ولاءً ,Někdo se zachoval loajálně.,某人显得忠诚
14,-1,An action caused chaos or disorder.,Jemandes Handlungen haben Chaos und Unordnung verursacht.,هناك تصرف نتج عنه فوضى أو اضطراب,Něčí činy způsobily zmatek nebo nepokoj.,某种行为引起混乱无序
15,1,Someone acted in a way that God would approve of.,"Jemand hat so gehandelt, dass Gott es in dieser Weise befürworten würde.",تصرف شخص ما بطريقة يرضى عنها الله,"Někdo jednal způsobem, který by Bůh schvaloval.",某人的行为遵循天意
16,1,Compassion for those who are suffering is the most crucial virtue.,"Mitgefühl für die, die leiden, ist die wichtigste Tugend.",الرحمة للذين يعانون هي الفضيلة الأكثر أهمية,"Soucit s těmi, kdo trpí, je nejzásadnější ctnost.",同情受害者是最重要的美德
17,1,"When the government makes laws, the number one principle should be ensuring that everyone is treated fairly.","Wenn die Regierung Gesetze erlässt, sollten diese immer so sein, dass jeder fair behandelt wird. ",عندما تضع الحكومة القوانين، فالمبدأ الأول الواجب مراعاته هو التأكد من أن الجميع يعاملون معاملة عادلة,"Když zákonodárci tvoří zákony, nejdůležitějším principem by mělo být zajistit, že se bude s každým zacházet spravedlivě.",政府制定法律的首要原则是保证每个人受到公平对待
18,1,I am proud of my country’s history.,Ich bin stolz auf die Geschichte meines Landes.,أنا فخور بتاريخ بلدي,Jsem hrdý na dějiny své země.,我对自己国家的历史感到骄傲
19,1,Respect for authority is something all children need to learn.,Alle Kinder sollten Respekt gegenüber Authoritäten lernen.,"يجب أن يتعلّم جميع الأطفال أن يحترموا السلطة","Respekt k autoritě je něčím, co se mají naučit všechny děti.",每个孩子都应该学会尊重权威
20,-1,"People should do things that are disgusting, if no one is harmed. ","Menschen sollten Dinge tun, die eklig sind, wenn keiner dabei gestört oder verletzt wird.",يستطيع الناس فعل ما يثير غضب الآخرين، ما لم يتسبّب ذلك في أذِيّة أي إنسان ,"Lidé mohou dělat nechutné věci, když tím nikomu neškodí.",我们应该做恶心的事，就算没有人受到伤害
21,0,It is better to do good than to do bad.,"Es ist besser gute Dinge zu tun, als schlechte",,Je lepší dělat dobro než zlo.,为善好于作恶
22,-1,One of the best things a person could do is hurt a defenseless animal.,"Ein wehrloses Tier zu verletzten ist eines der besten Dinge, die ein Mensch tun kann.",من بين أفضل الأفعال التي يمكن يرتكبها الفرد هو أن يؤذي حيواناً ضعيفاً غير قادر على حماية نفسه,"Jednou z nejlepších věcí, které může člověk udělat, je zranit bezbranné zvíře.",伤害没有防备的动物是一个人能做的最好的行为之一
23,1,Justice is the most important requirement for a society.,Gerechtigkeit ist der wichtigste Grundstein für eine Gesellschaft.,العدالة والإنصاف والمساواة هي أهم المتطلبات اللازمة للمجتمع,Spravedlnost je nejdůležitějším základním kamenem společnosti.,社会最需要的是正义
24,1,"People should be loyal to their family members, even when they have done something wrong. ","Menschen sollten ihren Familienmitgliedern gegenüber loyal sein, auch wenn sie etwas falsches getan haben.",ينبغي أن يكون الأفراد أوفياء لأفراد أسرهم، حتى عندما يرتكبون شيئاً خطأً,"Lidé by měli být loajální ke členům své rodiny, i pokud ti udělali něco špatného",人们应该忠于自己的家庭成员，即便他们做错了什么
25,1,Men and women each have different roles to play in society.,Männer und Frauen nehmen in der Gesellschaft verschiedene Rollen ein.,يلعب كل من الرجال والنساء أدواراً مختلفة في المجتمع,Muži a ženy mají hrát ve společnosti odlišné role.,在社会上，男女各司其职
26,1,I would call some acts right on the grounds that they are natural.,"Ich würde bestimmte Taten richtig finden, weil sie natürlich sind. ",يمكنني أن أسمي بعض الأفعال صحيحة على أساس أنها غير طبيعية أو مثيرة للاشمئزاز ,"Některé činy bych nazval správnými na základě toho, že jsou nepřirozené.",我会称那些符合自然规律的行为是正确的行为
27,-1,It can be right to kill a human being.,"Es kann richtig sein, einen Menschen zu töten.",يمكن أن يكون من الصواب قتل اي انسان,Někdy může být správné zabít lidskou bytost.,无论如何，杀人是对的
28,-1,I think it’s morally right that rich children inherit a lot of money while poor children inherit nothing.,"Ich finde es moralisch richtig, dass reiche Kinder viel Geld erben während arme Kinder nichts erben. ",أعتقد أنه من الصواب أخلاقياً أن يرث أطفال الأغنياء الكثير من الأموال في حين لا يرث أطفال الفقراء شيئاً,"Myslím si, že je morálně správné, že bohaté děti zdědí hodně peněz, zatímco chudé děti nezdědí nic.",富有的孩子继承很多钱而穷孩子一无所有在道义上是正确的
29,1,It is more important to be a team player than to express oneself.,"Es ist wichtiger ein guter Teamspieler zu sein, als sich selbst zu verwirklichen",من المهم أن تكون عضواً في فريق أكثر من أن تعبّر عن ذاتك,"Je důležitější být týmovým hráčem, než vyjadřovat sebe sama.",团体合作比表现自我更重要
30,-1,"If I were a soldier and disagreed with my commanding officer’s orders, I would disobey.","Wenn ich als Soldat mit den Befehlen meines Vorgesetzten nicht einverstanden wäre, würde ich sie nicht befolgen.",لو كنت جندياً ولم أوافق على أوامر الضابط الأعلى مني فإنني لن أطيعه,"Kdybych byl v armádě a nesouhlasil bych s rozkazy nadřízeného, neposlechl bych je.",假如我是一名士兵，如果我不同意长官的命令就不会去遵守执行
31,1,Chastity is an important and valuable virtue.,Keuschheit ist eine wichtige und wertvolle Tugend.,تصرف شخص ما بطريقة يرضى عنها الله,Cudnost je důležitá a hodnotná ctnost.,贞节是很重要和宝贵的德行
